{
  "@context": [
    "https://www.w3.org/2018/credentials/v1",
    "https://schemata.openattestation.com/com/openattestation/1.0/DrivingLicenceCredential.json",
    "https://schemata.openattestation.com/com/openattestation/1.0/OpenAttestation.v3.json",
    "https://schemata.openattestation.com/com/openattestation/1.0/CustomContext.json"
  ],
  "reference": "SERIAL_NUMBER_123",
  "name": "Republic of Singapore Driving Licence",
  "issuanceDate": "2010-01-01T19:23:24Z",
  "validFrom": "2010-01-01T19:23:24Z",
  "issuer": { "id": "https://example.com", "name": "DEMO STORE", "type": "OpenAttestationIssuer" },
  "type": ["VerifiableCredential", "DrivingLicenceCredential", "OpenAttestationCredential"],
  "credentialSubject": {
    "id": "did:example:JOHN_DOE_DID",
    "licenseNumber": "S1234567a",
    "birthDate": "1977-02-22",
    "name": "John Doe",
    "class": [
      { "type": "3", "effectiveDate": "2010-01-01T19:23:24Z" },
      { "type": "3A", "effectiveDate": "2010-01-01T19:23:24Z" }
    ]
  },
  "openAttestationMetadata": {
    "template": {
      "name": "DRIVING_LICENSE",
      "type": "EMBEDDED_RENDERER",
      "url": "https://tutorial-renderer.openattestation.com"
    },
    "proof": {
      "type": "OpenAttestationProofMethod",
      "method": "DID",
      "value": "did:ethr:0xE712878f6E8d5d4F9e87E10DA604F9cB564C9a89",
      "revocation": {
        "type": "NONE"
      }
    },
    "identityProof": {
      "type": "DNS-DID",
      "identifier": "example.tradetrust.io"
    }
  },
  "attachments": [{ "fileName": "sample.pdf", "mimeType": "application/pdf", "data": "BASE64_ENCODED_FILE" }]
}
