{
  "@context": [
    "https://www.w3.org/2018/credentials/v1",
    "https://schemata.openattestation.com/com/openattestation/1.0/DrivingLicenceCredential.json",
    "https://schemata.openattestation.com/com/openattestation/1.0/OpenAttestation.v3.json",
    "https://schemata.openattestation.com/com/openattestation/1.0/CustomContext.json"
  ],
  "type": ["VerifiableCredential", "DrivingLicenceCredential", "OpenAttestationCredential"],
  "reference": "SERIAL_NUMBER_123",
  "name": "Republic of Singapore Driving Licence",
  "issuanceDate": "2010-01-01T19:23:24Z",
  "validFrom": "2010-01-01T19:23:24Z",
  "issuer": {
    "id": "https://example.com",
    "type": "OpenAttestationIssuer",
    "name": "DEMO STORE"
  },
  "credentialSubject": {
    "id": "did:example:SERIAL_NUMBER_123",
    "class": [
      {
        "type": "3",
        "effectiveDate": "2010-01-01T19:23:24Z"
      },
      {
        "type": "3A",
        "effectiveDate": "2010-01-01T19:23:24Z"
      }
    ]
  },
  "openAttestationMetadata": {
    "template": {
      "name": "CUSTOM_TEMPLATE",
      "type": "EMBEDDED_RENDERER",
      "url": "https://localhost:3000/renderer"
    },
    "proof": {
      "type": "OpenAttestationProofMethod",
      "method": "DOCUMENT_STORE",
      "value": "0x9178F546D3FF57D7A6352bD61B80cCCD46199C2d"
    },
    "identityProof": {
      "type": "DNS-TXT",
      "identifier": "tradetrust.io"
    }
  },
  "attachments": [
    {
      "fileName": "sample.pdf",
      "mimeType": "application/pdf",
      "data": "BASE64_ENCODED_FILE"
    }
  ]
}
